{
  "$schema": "https://json-schema.org/draft/2020-12/schema",
  "type": "object",
  "properties": {
    "schemaVersion": {
      "type": "number",
      "const": 1
    },
    "kind": {
      "type": "string",
      "const": "viral-hit-publishing-connector"
    },
    "id": {
      "type": "string",
      "pattern": "^ext\\.[a-z][a-z0-9-]{0,59}$"
    },
    "version": {
      "type": "string",
      "maxLength": 14,
      "pattern": "^\\d+\\.\\d+\\.\\d+$"
    },
    "label": {
      "type": "string",
      "minLength": 1,
      "maxLength": 80
    },
    "description": {
      "type": "string",
      "minLength": 1,
      "maxLength": 500
    },
    "scope": {
      "type": "string",
      "enum": [
        "general",
        "specialized"
      ]
    },
    "author": {
      "type": "string",
      "minLength": 1,
      "maxLength": 120
    },
    "license": {
      "type": "string",
      "minLength": 1,
      "maxLength": 80
    },
    "entry": {
      "default": "connector.mjs",
      "type": "string",
      "pattern": "^[A-Za-z0-9_-]+\\.mjs$"
    },
    "mediaTypes": {
      "minItems": 1,
      "maxItems": 9,
      "type": "array",
      "items": {
        "type": "string",
        "enum": [
          "image/png",
          "image/jpeg",
          "image/webp",
          "video/mp4",
          "video/webm",
          "audio/wav",
          "audio/mpeg",
          "audio/mp4",
          "audio/ogg"
        ]
      }
    },
    "maxAssets": {
      "default": 1,
      "type": "integer",
      "minimum": 1,
      "maximum": 20
    },
    "environment": {
      "default": [],
      "maxItems": 24,
      "type": "array",
      "items": {
        "type": "string",
        "pattern": "^[A-Z][A-Z0-9_]{0,100}$"
      }
    },
    "destinations": {
      "minItems": 1,
      "maxItems": 30,
      "type": "array",
      "items": {
        "type": "object",
        "properties": {
          "id": {
            "type": "string",
            "pattern": "^[a-zA-Z0-9_.-]{1,128}$"
          },
          "label": {
            "type": "string",
            "minLength": 1,
            "maxLength": 100
          },
          "destinationId": {
            "type": "string",
            "pattern": "^[a-zA-Z0-9_.-]{1,128}$"
          },
          "configuration": {
            "default": {},
            "type": "object",
            "propertyNames": {
              "type": "string"
            },
            "additionalProperties": {
              "$ref": "#/$defs/__schema0"
            }
          }
        },
        "required": [
          "id",
          "label",
          "destinationId"
        ],
        "additionalProperties": false
      }
    },
    "metadataSchema": {
      "type": "object",
      "propertyNames": {
        "type": "string"
      },
      "additionalProperties": {
        "$ref": "#/$defs/__schema1"
      }
    },
    "measurement": {
      "type": "object",
      "properties": {
        "metrics": {
          "minItems": 1,
          "maxItems": 40,
          "type": "array",
          "items": {
            "type": "string",
            "pattern": "^[a-z][a-z0-9_]{0,63}$"
          }
        }
      },
      "required": [
        "metrics"
      ],
      "additionalProperties": false
    }
  },
  "required": [
    "schemaVersion",
    "kind",
    "id",
    "version",
    "label",
    "description",
    "scope",
    "author",
    "license",
    "mediaTypes",
    "destinations",
    "metadataSchema"
  ],
  "additionalProperties": false,
  "$defs": {
    "__schema0": {
      "anyOf": [
        {
          "type": "string"
        },
        {
          "type": "number"
        },
        {
          "type": "boolean"
        },
        {
          "type": "null"
        },
        {
          "type": "array",
          "items": {
            "$ref": "#/$defs/__schema0"
          }
        },
        {
          "type": "object",
          "propertyNames": {
            "type": "string"
          },
          "additionalProperties": {
            "$ref": "#/$defs/__schema0"
          }
        }
      ]
    },
    "__schema1": {
      "anyOf": [
        {
          "type": "string"
        },
        {
          "type": "number"
        },
        {
          "type": "boolean"
        },
        {
          "type": "null"
        },
        {
          "type": "array",
          "items": {
            "$ref": "#/$defs/__schema1"
          }
        },
        {
          "type": "object",
          "propertyNames": {
            "type": "string"
          },
          "additionalProperties": {
            "$ref": "#/$defs/__schema1"
          }
        }
      ]
    }
  }
}
